{
  "schema_version": "1.2",
  "directive_id": "dir.stats.task.001",
  "session_id": "session.stats.001",
  "subject": "statistics",
  "directive_type": "task_type",
  "issued_at": "2026-09-13T09:05:00Z",
  "authority": "ADVISORY",
  "source_event_ids": [],
  "payload": {
    "task_type": "SIMULATION"
  }
}
